genre,title,artist,songId,albumId,lyrics
댄스,U-Go-Girl (With 낯선),이효리,1903050,389651,"Hey girl 
It's the princess LEE HYO REE 
She's Back Yeah 
2008 You ready 
Hey girl 
Girl girl Hey u go girl 
De le De le 
that that that girl 
Girl girl Hey u go girl 
Baby baby baby baby girl 
Say what 
오늘은 또 어떤 옷을 입어야할지 
머리는 또 어떻게 만져야 좋을지 
이건 어떠니 또 저건 어떠니 
고민 고민하지마 Girl 
오늘은 또 어떤 말을 해야하는지 
어떻게 내 마음을 전해야 좋을지 
이건 어떠니 또 저건 어떠니 
고민 고민하지마 Girl 
Girl hey U go girl 
De le De le 
that that that girl 
Girl hey U go girl 
Baby baby baby baby girl 
이제부터 솔직하게 
이제부터 당당하게 
너의 맘을 보여줘 
바로 이 순간 
지금 이 순간 tonight 
가끔씩은 달콤하게 
가끔씩은 강렬하게 
너의 맘을 보여줘 
바로 이 순간 
지금 이 순간 tonight 
Girl girl Hey u go girl 
De le De le 
that that that girl 
Girl girl Hey u go girl 
Baby baby baby baby girl 
오늘은 또 어쩐 일로 
나를 부르지 
혹시나 또 무슨 일이 생긴건지 
이걸 어쩌지 또 저걸 어쩌지 
고민 고민하지마 Girl 
그 사람도 좋아할까 마음 졸이며 
주머니 속 작은 동전 하나 꺼내서 
앞면이 나올지 뒷면이 나올지 
고민 고민하지마 Girl 
Girl hey U go girl 
De le De le 
that that that girl 
Girl hey U go girl 
Baby baby baby baby girl 
이제부터 솔직하게 
이제부터 당당하게 
너의 맘을 보여줘 
바로 이 순간 
지금 이 순간 tonight 
가끔씩은 달콤하게 
가끔씩은 강렬하게 
너의 맘을 보여줘 
바로 이 순간 
지금 이 순간 tonight 
Crazy night 
Dance All Night 
Let Me Take U Home Tonight 
It's allright 
Hey girl party tonight 
Crazy night 
Dance All Night 
Let Me Take U Home Tonight 
It's allright 
Hey girl party tonight 
Girl girl Hey u go girl 
De le De le 
that that that girl 
Girl girl Hey u go girl 
Baby baby baby baby girl 
Girl girl Hey u go girl 
De le De le 
that that that girl 
Girl girl Hey u go girl 
Baby baby baby baby girl 
I like that that that girl 
and Let Me SeeYa bring it 
back back back girl 
OK I like that that that girl 
and Let Me SeeYa bring it 
back back back girl 
One more time baby 
I like that that that girl 
and Let Me SeeYa bring it 
back back back girl 
OK I like that that that girl 
and Let Me SeeYa bring it 
back back back girl 
Girl"
댄스,UGLY,2NE1,3509751,1356152,"밝게 웃어보지만
내 맘에 들지 않아
난 예쁘지 않아 아름답지 않아
Oh oh oh oh 
Oh oh oh oh 
노랠 불러보지만
아무도 듣지 않아
난 예쁘지 않아 아름답지 않아
Oh oh oh oh 
Oh oh oh oh 
난 왜 이렇게 못난 걸까
어떡하면 나도 너처럼 환하게 
웃어볼 수 있을까
또 화가나 왜 늘 완벽하지 못해
이 깨진 거울 속 못난 모습을 향해 
탓하기만 해
쳐다보지마 지금 이 느낌이 싫어 난
어디론가 숨고만 싶어 
벗어 나고 싶어
이 세상은 거짓말
I think I’m ugly
And nobody wants to love me
Just like her I wanna be pretty 
I wanna be pretty
Don’t lie to my face tellin’ 
me I’m pretty
I think I’m ugly
And nobody wants to love me        
Just like her I wanna be pretty 
I wanna be pretty
Don’t lie to my face cuz I know 
I’m ugly
날 쉽게 이해한다고 하지마
못 생기고 삐뚤어진 내 마음이 널 
원망할지도 몰라
말 시키지마 난 너와 어울리지 못해
그 잘난 눈빛 속 차가운 가식이 날 
숨막히게 해
다가오지마 너의 관심조차 싫어 난
어디론가 떠나고 싶어 소리 치고 
싶어
이 세상은 거짓말
I think I’m ugly
And nobody wants to love me
Just like her I wanna be pretty 
I wanna be pretty
Don’t lie to my face tellin’ 
me I’m pretty
I think I’m ugly
And nobody wants to love me
Just like her I wanna be pretty 
I wanna be pretty
Don’t lie to my face cuz I know 
I’m ugly
All alone
I’m all alone 
I’m all alone 
따뜻함이란 없어
곁엔 아무도 없어
All alone I’m all alone 
All alone I’m all alone
I’m always all alone
따뜻함이란 없어
곁엔 그 누구도 날 안아줄 사람 없어
I think I’m ugly
And nobody wants to love me
Just like her I wanna be pretty 
I wanna be pretty
Don’t lie to my face tellin’ 
me I’m pretty
I think I’m ugly
And nobody wants to love me
Just like her I wanna be pretty 
I wanna be pretty
Don’t lie to my face cuz I know 
I’m ugly"
댄스,심쿵해 (Heart Attack),AOA,5748406,2325321,"A ye Brave sound 
And it goes a little something like this 
완전 반해 반해 버렸어요 
부드러운 목소리에 
반해 반해 버렸어요 
난 떨려 
AOA Let's Go 
내가 미쳤나 봐 왜 또 이러지 
내 마음 열여덟 소녀 마냥 
막 쿵쿵대 
숨길 수 없나 봐 난 매일 이러지 
눈이라도 마주치면 
귀까지 확 빨개져  
이해 못해 
네가 걔를 못 봐서 그래  
딱 첫눈에 확 반해 버린다는 말에 
그 마음 이해 가더라 
나도 좀 알겠더라 
널 처음 본 그 순간 
완전 반해 반해 버렸어요  
넓은 어깨 날렵한 눈매에  
부드러운 목소리에 
반해 반해 버렸어요 
너의 얇고 긴 손가락만 봐도 
난 떨려  
어머나 자꾸만 심쿵해 
널 보면 볼수록 
가슴이 쿵쿵대 나도 모르겠어 
심쿵해 나 어쩌면 좋아 
자꾸만 네 품에 
꼭 안기고 싶어 baby 
어쩌다 눈이라도 마주치면 
난 심쿵 거려  
너의 작은 관심이라도 받을까 
아등바등 거려 
너는 대체 걔가 뭐가 그리 좋아 
라고 묻는 친구들에게 말해 
야 모르면 말을 말어 
이해 못해 네가 걔를 못 봐서 그래 
딱 첫눈에 확 반해 버린다는 말에 
그 마음 이해 가더라 
나도 좀 알겠더라 
널 처음 본 그 순간 
완전 반해 반해 버렸어요  
넓은 어깨 날렵한 눈매에  
부드러운 목소리에 
반해 반해 버렸어요 
너의 얇고 긴 손가락만 봐도
난 떨려 
어머나 자꾸만 심쿵해
널 보면 볼수록
가슴이 쿵쿵대 나도 모르겠어
심쿵해 나 어쩌면 좋아
자꾸만 네 품에
꼭 안기고 싶어 baby
오 나의 왕자님 어디를 보나요
바로 여기 내가 있는데요
너무나 멋진 그대
난 그대 하나면 돼
난 그대 없이 못 살아요 
완전 반해 반해 버렸어요
부드러운 목소리에
반해 반해 버렸어요
난 떨려
어머나 자꾸만 심쿵해 
Everybody say What AOA
쿵쿵대
And it goes a little something like this
심쿵해
한번 더 say What AOA
네 품에 꼭 안기고 싶어 baby"
댄스,Fiction,비스트,3403761,1276855,"아직 난 널 잊지 못하고  
모든걸 다 믿지 못하고 
이렇게 널 보내지 못하고  
오늘도 
다시 만들어볼게 우리 이야기  
끝나지 않게 아주 기나긴 
살갗을 파고 스며드는  
상실감은 잠시 묻어둘게 
새로 써 내려가 시작은  
행복하게 웃고 있는 너와 나 
네가 날 떠나지 못하게  
배경은 출구가 없는 좁은 방 안 
아무렇지 않게 네게 키스하고  
달콤한 너의 곁을 떠나가질 못해 
우린 끝이라는건 없어 
이렇게 난 또  
Fiction in Fiction 
잊지 못하고  
Fiction in Fiction 
내 가슴 속에  
끝나지 않을 이야길  
쓰고 있어 
널 붙잡을게  
Fiction in Fiction 
놓지 않을게  
Fiction in Fiction in Fiction 
끝나지 않은 너와 나의 이야기  
속에서 오늘도 in Fiction 
지금 여긴 행복한  
이야기들밖에 없어 
너무 행복한  
우리 둘만의 이야기가  
이렇게 현실과는 다르게 
써 있어 점점 채워지고 있어 
너는 나에게로 달려와서 안기고 
품 안에 안긴 너를 나는  
절대 놓지 못해 
우린 끝이라는건 없어 
이렇게 난 또 
Fiction in Fiction
잊지 못하고 
Fiction in Fiction
내 가슴 속에 끝나지 않을 
이야길 쓰고 있어
널 붙잡을게 
Fiction in Fiction
놓지 않을게 
Fiction in Fiction in Fiction
끝나지 않은 너와 나의 
이야기 속에서 
오늘도 in Fiction
다시 한 번 더 말하지만
지금 너는 내 옆에 있다고 
그렇게 믿고 있어 난
하지만 Fiction
난 목적을 잃어버린 
작가 이 소설의끝은 
어떻게 마무리 지어야 해
사랑해 사랑해 사랑해 사랑해 
사랑해 이 세 글자만
써 내려가 무뎌진 펜 눈물로 
얼룩진 낡은 종이 위로
행복할 수도 슬플 수도 없어
이 이야기는
지금 난 너무나도 
행복한 생각에 
이야기를 쓰지만
모든게 바램일 뿐이라고 여전히
난 행복한걸 
Fiction in Fiction in Fiction
우리 함께인걸 
Fiction in Fiction in Fiction
이제 시작인걸 
Fiction in Fiction in Fiction
끝은 없는걸 
Fiction in Fiction in Fiction"
댄스,커플,젝스키스,81013,5360,"예전보다 지금 니가
더욱 괜찮을 거야 
허전했던 나의 빈 곳을
이젠 채워 줬으니
아름다운 세상에서
많이 외로워 하며
내 반쪽을 찾아 헤맨 건
모두 옛날 얘긴 걸
내 생애 이 시간만을
얼마나 기다렸는지
마치 꿈만 같은 걸
이젠 나 혼자가 아닌
너와 함께 하는 거야
Oh LOVE 왜 이제서야
많이 외롭던 나를 찾아온 거야
Oh LOVE 너를 사랑해
이제 모든 시간들을 나와 함께해 
All right all right
When I saw you one time
I lost my heart to you
Oops baby I'll be loving you
forever with you now
Baby don't go too far
I won't let you go
Please don't go
I want to hold you tight
and I need your love
얼마나 수많은 날을
기다려 왔는 줄 아니
이젠 모두 앞에서
너의 손을 꼭 붙잡고
우린 함께 하는 거야
Oh LOVE 왜 이제서야
많이 외롭던 나를 찾아온 거야
Oh LOVE 너를 사랑해
이제 모든 시간들을 나와 함께해
과거 따윈 모두 잊고 나와 함께 할
많은 시간을 추억으로 만들어
Oh LOVE 왜 이제서야
많이 외롭던 나를 찾아온 거야
Oh LOVE 너를 사랑해
이제 모든 시간들을 나와 함께해"
댄스,Lion Heart,소녀시대 (GIRLS' GENERATION),5820368,2335204,"Oooh 너와 나 첨 만났을 때
Oooh 마치 사자처럼 맴돌다
기회를 노려 내 맘 뺏은 너
Ah 넌 달라진 게 없어 여전해
난 애가 타고 또 타
사냥감 찾아 한 눈 파는 너
수백 번 밀어내야 했는데 
수천 번 널 떠나야 했는데
Tell me why
왜 맘이 맘이 자꾸 흔들리니
난 여기 여기 네 옆에 있잖니
정신 차려 Lion heart
난 애가 타
내 맘이 맘이 더는 식지 않게
난 여기저기 뛰노는 너의 맘
길들일래 Lion heart
OhOhOh OhOhOhOhOh 
OhOhOh OhOhOhOhOh
Oooh 넌 자유로운 영혼 여전해
충실해 본능 앞에
지금 네 옆에 난 안 보이니
수백 번 고민 고민해봐도
수천 번 결국 답은 너인데
Tell me why
왜 맘이 맘이 자꾸 흔들리니
난 여기 여기 네 옆에 있잖니
정신 차려 Lion heart
난 애가 타
내 맘이 맘이 더는 식지 않게
난 여기저기 뛰노는 너의 맘
길들일래 Lion heart
OhOhOh OhOhOhOhOh 
곤히 잠자는 나의 코끝을 Baby 
OhOhOh OhOhOhOhOh
네가 건드려 나도 화가 나 Baby 
Tell me why
왜 맘이 맘이 자꾸 흔들리니
난 여기 여기 네 옆에 있잖니
정신 차려 Lion heart
난 애가 타
내 맘이 맘이 더는 식지 않게
난 여기저기 뛰노는 너의 맘
길들일래 Lion heart
Ladies y’all know 
what I’m talking about right
Yeah 
모두 다 아니라 해도 
좋을 때 있지 않아
사실 나만 좋음 됐지 뭐 
바람보다 빠른 눈치로 
맘은 뜨겁게
햇살처럼 따뜻한 말로 
머린 차갑게
길들일래 너의 Lion heart 
사자 같은 너의 Lion heart
Lalala Lalalalala 
여기 와서 앉아 
Lalala Lalalalala
내 곁에만 있어
Lalala Lalalalala
한 눈 팔지 말아 
Lion heart"
댄스,비행기,거북이,1325050,322845,"Yes Turtles Forth album
New mind New song 
철없을 적 내 기억속에
비행기 타고가요 
Yeah Let's go 
파란 하늘위로 훨훨 날아가겠죠 
어려서 꿈꾸었던 비행기 타고 
기다리는 동안 아무말도 못해요 
내 생각 말할순 없어요 
모든 준비 다 끝났어 
곱게 차려 입고 나선 
바깥 풍경마저 들뜬 기분 
때가 왔어 하늘위로
날으는 순간이야 
조금은 두려워도 
애써 내색 할 순 없어
이번이 처음이지만 
전에 자주 비행했었잖아 
친구들과 말썽장이
거북이 비행기로 올라타 
준비됐나 
수많은 사람들 속을 지나쳐
마지막 게이트야 
나도 모르게 안절부절하고 있어 
이럴 땐 침착해 좀 자연스럽게 
파란 하늘위로 훨훨 날아가겠죠 
어려서 꿈꾸었던 비행기 타고 
기다리는 동안 아무말도 못해요 
내 생각 말할순 없어요
Yes Remember
비행기를 타고 가던 너
따라가고 싶어 울었던 
철없을 적 내 기억속에
비행기 타고가요 
Yes Fly 다들 아무 일도 없는 듯 
하늘을 나르는데 아무걱정 없는 듯 
왠지 철닥서니 없었나 문득
이런 내 모습 촌스러 입 다문듯 
쳐다보지 말아요 
다들 처음 탈 때 이러지 않았나요 
딴 데 봐요 
신경 쓰지 마요 
나 혼자 이런게 나 좋아요 
어떤 느낌일까 정말
새들처럼 나는 기분 
세상 모든 것이 점처럼
보 여 지겠지 
개구쟁이 거북이
비행기로 드디어 출발한다 
수많은 사람들 속을 지나쳐
마지막 게이트야 
나도 모르게 안절부절하고 있어 
이럴 땐 침착해 좀 자연스럽게 
파란 하늘위로 훨훨 날아가겠죠 
어려서 꿈꾸었던 비행기 타고 
기다리는 동안 아무말도 못해요 
내 생각 말할순 없어요 
파란 하늘위로 훨훨 날아가겠죠 
어려서 꿈꾸었던 비행기 타고 
기다리는 동안 아무말도 못해요 
내 생각 말할순 없어요 Yes Remember
비행기를 타고 가던 너
따라가고 싶어 울었던 
철없을 적 내 기억속에
비행기 타고가요"
댄스,미리 메리 크리스마스 (Feat. 천둥 Of MBLAQ),아이유,3053259,1093562,"하얀 눈이 내려올 때면
온 세상이 물들을 때면
눈꽃이 피어나 또 빛이 나
눈이 부신 너처럼
Yeah girl
you should know that
That my heartbeats like
Huh Huh Huh Huh
From the bottom of my heart
I thank god I found you
쿵쿵 가슴이 왜 이렇게 가쁘니 yeah
꾹꾹 참아도
자꾸 네 생각이 나잖아 oh
You You I love you
and I know you love me too
네가 내게 불러 준
You're my boo
You 아직 꿈만 같아
And you 마치 선물 같아
For you 네 품에 안겨도
늘 불안불안 해 꿈처럼 깰까 봐
You 꼭 안아 줘야만 해
And you 아껴 줘야만 해
For you 큰 맘 먹고 네 꺼 돼준 걸
하늘에게 감사해
하얀 눈이 내려올 때면
온 세상이 물들을 때면
눈꽃이 피어나 또 빛이 나
눈이 부신 너처럼
사랑할 수 밖에 없어서
사랑한 네 손 잡고서
첫 눈 위를 걸어 발자국을 새겨
이 길 끝까지 걸어 갈 거야
With you
You 혹시 알고 있니
And you 느낄 수가 있니
For you 늘 자랑하고픈
네 여자친구가 되고만 싶은 걸
You 전부 다 주고 싶어
And you 잘 해주고 싶어
For you 다음 그 다음 해 겨울도
너의 곁에 있을게
하얀 눈이 내려올 때면
온 세상이 물들을 때면
눈꽃이 피어나 또 빛이 나
눈이 부신 너처럼
사랑할 수 밖에 없어서
사랑한 네 손 잡고서
첫 눈 위를 걸어 발자국을 새겨
이 길 끝까지 걸어 갈 거야
With you
매일 매일 너 때문에 행복해
다른 누구 아닌 나를
모두 가질 너만이 My love
나도 믿기지 않아
지금 네가 내 옆에
이렇게 손 꼭 잡은 채 걷는다는 게
하얀 눈보다 더 뽀얀 네 볼에
키스해줄게 Baby
빨갛게 물들게 Baby
다가오는 크리스마스에는
기다리는 그 날만큼은
네 곁에 있을래
하루 종일 미리 미리 약속해
사랑할 수 밖에 없어서
사랑한 네 손 잡고서
첫 눈 위를 걸어 발자국을 새겨
이 길 끝까지 걸어 갈 거야
With you
Girl you know
I can't even think without you
in my life
Yeah Yeah I know that you know
That's my baby"
댄스,I Don't Care,2NE1,2212365,598055,"hey playboy
it's about time and your time's up
I had to do this one for my girls
you know
sometime you gotta act like
you don't care
that's the only way you boys learn
Oh oh oh oh oh oh 2ne1
Oh oh oh oh oh oh 2ne1
니 옷깃에 묻은 립스틱들
나는 절대로 용서못해
매일 하루에 수십번 꺼져있는 핸드폰
변하지 않을 것만 같아 oh oh
그저 친구라는 수많은 여자친구
날 똑같이 생각하지 마
I won't let it fight
이제 니 맘대로 해 난 미련은 버릴래
한땐 정말 사랑했는데 oh oh
가끔씩 술에 취해 전활 걸어
지금은 새벽 다섯시 반
넌 또 다른 여자애 이름을 불러
no no
I don't care 그만할래
니가 어디에서 뭘 하던
이제 정말 상관 안할게 비켜줄래
이제와 울고불고 매달리지마
cause I don't care e e e e e
I don't care e e e e e
cause I don't care e e e e e
I don't care e e e e e
Boy I don't care
다른 여자들의 다리를 훔쳐보는
니가 너무너무 한심해
매일 빼놓는 커플링
나 몰래 한 소개팅
더 이상 못 참을 것 같아 oh oh
넌 절대 아니라는 수많은 나의 친구
난 너 땜에 친구들까지 다 잃었지만
차라리 홀가분해 너에게 난 과분해
내 사랑이라 믿었는데 oh oh
오늘도 바쁘다고 말하는 너
혹시나 전화해봤지만
역시 뒤에선 여자 웃음소리가 들려
oh no
I don't care 그만할래
니가 어디에서 뭘 하던
이제 정말 상관 안할게 비켜줄래
이제와 울고불고 매달리지마
cause I don't care e e e e e
I don't care e e e e e
cause I don't care e e e e e
I don't care e e e e e
Boy I don't care
난 너 땜에 울며 지새던
밤을 기억해 boy
더 후회할 날 생각하면
맘이 시원해 boy
날 놓치긴 아깝고 갖기엔 시시하잖니
있을 때 잘하지
너 왜 이제와 매달리니
속아준 거짓말만 해도 수백번
오늘 이후로 난 남자 울리는 bad girl
이젠 눈물 한방울 없이 널 비웃어
사랑이란 게임 속 loser
무릎꿇고 잘못을 뉘우쳐
아님 눈 앞에서 당장 꺼져
I don't care 그만할래
니가 어디에서 뭘 하던
이제 정말 상관 안할게 비켜줄래
이제와 울고불고 매달리지마
you know I don't care e e e e e e
I don't care e e e e e
I don't care e e e e e
I don't care e e e e e
Boy I don't care"
댄스,붉은 노을,BIGBANG (빅뱅),1951550,405351,"붉은 노을 - 빅뱅
난 너를 사랑해
Let's go
Yes sir
We're back again with 이문세
That's right
Fresh collaboration 2008
It's bigbang
ye ye bust it
그댄 아시나요 있잖아요
지금 그대가 너무 그리워요
고개 숙여 눈물 훔쳐요
당신의 이름을 불러요
꼭 이렇게 날 남겨두고
떠나가야만 했는지
너만 생각하면 머리 아퍼
독하디 독한 술 같어
술 뿐이겠어 병이지
매일 앓아누워 몇 번인지
내일이면 또 잠깐 잊었다가 또
모레쯤이면 생각나겠지만
그래도 어떡해
아직 내 사랑 유효한데
돌아올 거라고 믿는데
난 너만 기다리는데
난 너를 사랑해
Oh I love you girl
이 세상은 너 뿐이야
소리쳐 부르지만
저 대답 없는 노을만 붉게 타는데
혹시 그대가 미안해한다면
내 얼굴 보기 두렵다면
Girl 그런 걱정 하덜덜덜 마
너라면 힘이 펄펄펄 나
보고 싶은 그대 얼굴
저 붉은 노을을 닮아
더 슬퍼지는 걸
Oh baby baby
다 지나간 시간
우리가 함께한 추억
잊진 말아줘요 눈을 감아
소리 없이 날 불러준다면
언제라도 달려 갈께요
Everyday everynight
I need you
난 너를 사랑해
Oh I love you girl
이 세상은 너 뿐이야
소리쳐 부르지만
저 대답 없는 노을만 붉게 타는데
아름다웠던 그대 모습을
이젠 볼 순 없겠지만
후횐 없어 그저 바라볼 수 있게
붉게 타주오
Ah Ah Ah Ah Ah Ah Ah Ah
Let's go
Ah Ah Ah Ah Ah Ah Ah Ah
해가 뜨고 해가 지네
노을 빛에 슬퍼지네
달이 뜨고 달이 지네
세월 속에 나 또한 무뎌지네
해가 뜨고 해가 지네
노을 빛에 슬퍼지네
달이 뜨고 달이 지네
그대 기억 또한 무뎌지네
난 너를 사랑해
Oh I love you girl
이 세상은 너 뿐이야
소리쳐 부르지만
저 대답 없는 노을만 붉게 타는데
난 너를 사랑해
I love you girl
이 세상은 너 뿐이야
소리쳐 부르지만
저 대답 없는 노을만 붉게 타는데
Once again
Ah Ah Ah Ah Ah Ah Ah Ah
Let's go
Ah Ah Ah Ah Ah Ah Ah Ah
big bang"
댄스,좋은 날,아이유,3051244,1093562,"어쩜 이렇게 하늘은 더 파란 건지 
오늘따라 왜 바람은 또 완벽한지 
그냥 모르는 척 하나 못들은 척 
지워버린 척 딴 얘길 시작할까 
아무 말 못하게 입맞출까 
눈물이 차올라서 고갤 들어 
흐르지 못하게 또 살짝 웃어 
내게 왜 이러는지 무슨 말을 하는지 
오늘 했던 모든 말 저 하늘 위로 
한번도 못했던 말 
울면서 할 줄은 나 몰랐던 말 
나는요 오빠가 좋은걸 어떡해 

새로 바뀐 내 머리가 별로였는지 
입고 나왔던 옷이 실수였던 건지 
아직 모르는 척 기억 안 나는 척 
아무 일없던 것처럼 굴어볼까 
그냥 나가자고 얘기할까 
눈물이 차올라서 고갤 들어 
흐르지 못하게 또 살짝 웃어 
내게 왜 이러는지 무슨 말을 하는지 
오늘 했던 모든 말 저 하늘 위로 
한번도 못했던 말 
울면서 할 줄은 나 몰랐던 말 
나는요 오빠가 좋은걸 
어떡해 

이런 나를 보고 
그런 슬픈 말은 하지 말아요 
철없는 건지 조금 둔한 건지 
믿을 수가 없는걸요 
눈물은 나오는데 활짝 웃어 
네 앞을 막고서 막 크게 웃어 
내가 왜 이러는지 부끄럼도 없는지 
자존심은 곱게 접어 하늘위로 
한 번도 못했던 말 
어쩌면 다신 못할 바로 그 말 
나는요 오빠가 좋은걸 
아이쿠 하나 둘 
I'm in my dream 
It's too beautiful beautiful day 
Make it a good day 
Just don't make me cry 
이렇게 좋은 날"
댄스,너랑 나,아이유,3625504,2040666,"시곌 보며 속삭이는 비밀들
간절한 내 맘속 이야기
지금 내 모습을 해쳐도 좋아
나를 재촉하면 할수록 좋아
내 이름 불러줘
손 틈새로 비치는 내 맘 
들킬까 두려워
가슴이 막 벅차 서러워
조금만 꼭 참고 날 기다려줘
너랑 나랑은 지금 안되지
시계를 더 보채고 싶지만
네가 있던 미래에서
내 이름을 불러줘
내가 먼저 엿보고 온 시간들
너와 내가 함께였었지
나랑 놀아주는 그대가 좋아
내가 물어보면 그대도 좋아
내 이름이 뭐야
손 틈새로 비치는 내 맘 
들킬까 두려워
가슴이 막 벅차 서러워
조금만 꼭 참고 날 기다려줘
너랑 나랑은 지금 안되지
시계를 더 보채고 싶지만
네가 있던 미래에서
내 이름을 불러줘
눈 깜박하면 어른이 될 거에요
날 알아보겠죠 그댄 기억하겠죠
그래 기묘했던 아이
손 틈새로 비치는 네 모습 참 좋다
손끝으로 돌리며 
시곗바늘아 달려봐
조금만 더 빨리 날아봐
두 눈을 꼭 감고 마법을 건다
너랑 나랑은 조금 남았지
몇 날 몇실진 모르겠지만
네가 있을 미래에서
혹시 내가 헤맨다면
너를 알아볼 수 있게
내 이름을 불러줘"
댄스,SHAKE IT,씨스타,5748499,2325345,"너만을 유혹하는 춤 
우우우 우우우우
심장에 매력 발산 중 
우우우 우우우우
손끝만 스쳐도 막 쿵쿵쿵쿵 Oh
내 맘이 흔들려
Shake it shake it for me
Shake it shake it for me
나나나 나나나 나나나 
Hey
나나나 나나나 나나나 
짜릿한 이 느낌 
날 춤을 추게 해 
지금 이 순간 
Shake it
Bae bae baby
Love me love me love me now
흔들리는 내 맘 모르겠니
So let's dance
Just shake it let's dance
좀 더 핫하게 완전 와일드하게
Make it louder 우우우
더 크게 make it louder 우우우
날 자꾸 흔들어 흔들어
놀라게 흔들어
Shake it oh shake it
밤새 나와 Shake it baby
아주 fun하고 smart하게 
흔들흔들어
온몸이 찌릿찌릿 우리 둘이 
흔들흔들어
심하게 통하니 여기 불났으니
When I Move 
움직여 자리 잡았으니
Shake it shake it for me
Shake it shake it for me
나나나 나나나 나나나 
Hey
나나나 나나나 나나나 
짜릿한 이 느낌 
날 춤을 추게 해 
지금 이 순간 
Shake it
Bae bae baby
Love me love me love me now
흔들리는 내 맘 모르겠니
So let's dance
Just shake it let's dance
좀 더 핫하게 완전 와일드하게
Make it louder 우우우
더 크게 make it louder 우우우
날 자꾸 흔들어 흔들어
놀라게 흔들어
Shake it oh shake it
밤새 나와 Shake it baby
Shake it oh shake it
Shake it up shake it for me
Shake it oh shake it
Shake it up shake it for me
Shake it oh shake it
Shake it up shake it for me
Shake it oh shake it
Shake it up shake it for me
Shake it for me my baby
Shake it for me my baby
그렇게 모두 모여 dance
Just shake it let's dance
좀 더 핫하게 완전 와일드하게
Make it louder 우우우
더 크게 make it louder 우우우
날 자꾸 흔들어 흔들어
놀라게 흔들어
Shake it oh shake it
밤새 나와 Shake it baby"
